{
  "title": "Modulio 5 atmintinė. Prezentacijos sprintas.",
  "subtitle": "Užduoties aprašas → argumentų seka → juodraštis → kokybės patikra (25–30 min)",
  "toolsIntro": "DI (struktūra ir turinys): ChatGPT, Claude, Gemini. Įrankio medis: Gamma (rekomenduojama) · Copilot/Office · Canva. Kiti – pagal poreikį.",
  "toolsBullets": [
    "ChatGPT, Claude, Gemini – struktūra ir turinys",
    "Gamma (rekomenduojama) / Copilot / Canva – skaidrių formatas"
  ],
  "structure8": "1. Problema / kontekstas\n2. Kodėl tai svarbu dabar\n3. Sprendimo idėja\n4. Kaip tai veikia (paprastai)\n5. Pavyzdys / use case\n6. Nauda / rezultatai\n7. Rizikos / ribos\n8. Ką daryti toliau (CTA)",
  "masterPrompt": "Sukurk 8 skaidrių prezentacijos struktūrą (ne pilną turinį). Tema: [Įrašyti]. Auditorija: [Įrašyti]. Kiekvienai skaidrei pateik: pavadinimą ir 2–3 pagrindines mintis. Formatas: numeruotas sąrašas. Tonas: aiškus, non-tech.",
  "fullPromptPrinciple": "META + INPUT + OUTPUT + REASONING + QUALITY + ADVANCED. Storyline: sprendimas + 3 argumentai + CTA; antraštės = teiginiai.",
  "sequenceSteps": [
    "Užduoties aprašas (brief) – tema, auditorija, tikslas, skaidrių skaičius, tonas",
    "Argumentų seka (storyline) – sprendimas, 3 argumentai, CTA",
    "Struktūra – 8 skaidrių planas (teiginys + 2 bullet)",
    "Turinys – DI → įrankis (Gamma / Copilot / Canva)",
    "Kokybės patikra – 6 punktai + soft proof"
  ],
  "briefDefinition": "Užduoties aprašas (brief) – orientacija DI: tema, auditorija, tikslas, skaidrių skaičius, tonas/formatas. Argumentų seka (storyline) papildo: ką auditorija turi nuspręsti.",
  "qualityCheckPoints": [
    "Ar aiškus tikslas?",
    "Ar atitinka auditoriją?",
    "Ar logiška struktūra?",
    "Ar nėra „išgalvotų“ faktų? (šaltiniai arba prielaidos)",
    "Ar antraštės = teiginiai (ne temos)?",
    "Ar CTA aiškus?"
  ],
  "thresholdsExplanation": "≥70% – supranti brief, storyline, struktūrą ir kokybės patikrą; gali pereiti prie Modulio 6. Mažiau – peržiūrėk sprintą, QC lab ir nurodytas skaidres.",
  "footerText": "Promptų anatomija – promptų struktūros mokymas. © Kurso medžiaga."
}
