{
  "title": "Module 5 handout. Presentation sprint.",
  "subtitle": "Brief → storyline → draft → quality check (25–30 min)",
  "toolsIntro": "AI (structure and content): ChatGPT, Claude, Gemini. Tool tree: Gamma (recommended) · Copilot/Office · Canva. Others as needed.",
  "toolsBullets": [
    "ChatGPT, Claude, Gemini – structure and content",
    "Gamma (recommended) / Copilot / Canva – slide format"
  ],
  "structure8": "1. Problem / context\n2. Why it matters now\n3. Solution idea\n4. How it works (simply)\n5. Example / use case\n6. Benefits / results\n7. Risks / limits\n8. What to do next (CTA)",
  "masterPrompt": "Create an 8-slide presentation structure (not full content). Topic: [Enter]. Audience: [Enter]. For each slide provide: title and 2–3 key points. Format: numbered list. Tone: clear, non-tech.",
  "fullPromptPrinciple": "META + INPUT + OUTPUT + REASONING + QUALITY + ADVANCED. Storyline: decision + 3 arguments + CTA; titles = assertions.",
  "sequenceSteps": [
    "Brief – topic, audience, goal, slide count, tone",
    "Storyline – decision, 3 arguments, CTA",
    "Structure – 8-slide plan (assertion + 2 bullets)",
    "Content – AI → tool (Gamma / Copilot / Canva)",
    "Quality check – 6 points + soft proof"
  ],
  "briefDefinition": "Brief orients AI: topic, audience, goal, slide count, tone/format. Storyline adds: what the audience must decide.",
  "qualityCheckPoints": [
    "Is the goal clear?",
    "Does it match the audience?",
    "Is the structure logical?",
    "No \"made up\" facts? (sources or assumptions)",
    "Are titles assertions (not topic labels)?",
    "Is the CTA clear?"
  ],
  "thresholdsExplanation": "≥70% – you understand brief, storyline, structure and quality check; you can proceed to Module 6. Below 70% – review the sprint, QC lab and the indicated slides.",
  "footerText": "Prompt anatomy – prompt structure training. © Course material."
}
